,timestamp,likes,retweets,source,length,sentiment,tweet
0,2018-10-28 03:59:06,1,0,Twitter for iPhone,73,0.0,I’ve never agreed with Donald trump before but... https://t.co/zAtf4mI2r4
1,2018-10-28 03:59:06,0,0,Twitter for iPhone,244,0.40714285714285714,"What can we be fairly certain of, regarding the president’s comments about the shooting in my neighborhood today?
1. Jews aren’t shooting up their own synagogues.
2. Donald Trump is, will be and always has been an outright asshole.
3. repeat 2."
2,2018-10-28 03:59:04,0,0,Twitter Web Client,92,0.0,"not that it matters, but this tweet was not written by Donald Trump. https://t.co/wCSeexpcEx"
3,2018-10-28 03:59:04,0,0,Twitter Web Client,141,0.0,"@realDonaldTrump @SecretService #rickwilson
Rick Wilson says ""They're going to have to put a bullet in Donald Trump"".
https://t.co/UZPSU84dZb"
4,2018-10-28 03:59:03,0,0,Twitter Web Client,81,0.0,This will be the one and only time I retweet Donald Trump https://t.co/Uck9IskXb6
5,2018-10-28 03:59:01,0,0,Twitter Web Client,129,0.1595238095238095,Alt-right social media site Gab in meltdown mode after Pittsburgh shooting -- begs Donald Trump to 'ACT!' https://t.co/VxiLRrJIHY
6,2018-10-28 03:59:00,0,0,Twitter for Android,83,0.0,Blue Jays Central with Jamie Campbell &amp; Donald Trump 😤😤 https://t.co/f7eMqHacsi
7,2018-10-28 03:59:00,0,0,Facebook,111,-0.6,"Trump is lying to scare voters. Migrant caravan families are desperate, not terrorists. https://t.co/YMQ4srJMBa"
8,2018-10-28 03:58:57,0,0,Facebook,50,0.0,Donald J. Trump on Twitter https://t.co/ZnaigqQSJ8
9,2018-10-28 03:58:55,9,1,Twitter for iPhone,132,0.15,Why does this look like Donald Trump is about to drop his biopic with the most rap hip-hop heavy soundtrack? https://t.co/1aL13q0VNO
10,2018-10-28 03:58:54,0,0,Twitter for iPhone,99,0.0,@benmaller @realDonaldTrump Socks in friends with Donald Trump. Here comes the Los Angeles Dodgers.
11,2018-10-28 03:58:52,0,0,Twitter for iPhone,58,0.0,Even Donald Trump can see that 56’s govt is a sinking ship
12,2018-10-28 03:58:49,0,0,Twitter for iPhone,191,0.0,"“Along came the presidential campaign of Donald Trump, who welcomed all extremists, all outsiders, all outliers, and he felt that somebody was finally talking to him.” https://t.co/XMlWe76OID"
13,2018-10-28 03:58:48,0,0,Twitter Web Client,174,0.275,"""We must show the world that as Americas we are united in peace and love and harmony,"" said Trump, apparently excepting George Soros. https://t.co/uysFG4S6Rl via @HuffPostPol"
14,2018-10-28 03:58:46,0,0,Facebook,80,0.0,Robert De Niro issues warning to Donald Trump supporters https://t.co/icSRp7CutO
15,2018-10-28 03:58:42,0,0,Hootsuite Inc.,90,0.0,"I would like to see Donald Trump's reaction to that Kike Home Run

https://t.co/MPav2PkGIk"
16,2018-10-28 03:58:39,0,0,Twitter for iPhone,71,0.3333333333333333,That Donald Trump tweet has me super conflicted https://t.co/xIguaeCg5O
17,2018-10-28 03:58:32,0,0,Twitter for iPhone,76,0.5,Donald Trump still a better manager than Aaron Boone https://t.co/D9cxgqJ9dq
18,2018-10-28 03:58:32,0,1,Twitter for Android,85,1.0,@realDonaldTrump Donald Trump is the greatest president in the United States history!
19,2018-10-28 03:58:32,0,0,Twitter for iPhone,106,0.15,"Donald, motherfucking, piece of shit, Trump is a better manager than Dave Roberts. https://t.co/tqiGba49qH"
20,2018-10-28 03:58:30,0,0,Twitter for iPad,164,0.0,"‘Riling Up the Crazies’, via @nytimes
This is what America gets when someone like ⁦@realDonaldTrump⁩ steals an election with #Putin ‘s help. https://t.co/gGVtZy5zZ9"
21,2018-10-28 03:58:29,1,0,Twitter for Android,124,0.0,"Congratulations to the Los Angeles beat, who get to ask Dave Roberts about Donald Trump tweeting about his managing strategy"
22,2018-10-28 03:58:29,1,0,Twitter for iPhone,105,0.0,Donald Trump should manage the Yankees and if you think otherwise you’re a dunce! https://t.co/qp1liHlOoV
23,2018-10-28 03:58:28,0,0,Twitter Web Client,277,-0.36,"Trump’s massive umbrella fail https://t.co/tYUOJ1LMDa via @PalmerReport

#TerroristPresident @realDonaldTrump has lost his mind completely and he belongs in an insane asylum and behind bars for his #MAGATerrorism.

#TrumpIsATerrorist #TrumpIsAMentalNuthead #TrumpIsMentallyGone"
24,2018-10-28 03:58:27,0,0,Twitter for iPhone,114,0.17500000000000002,the very first time in my whole life and the only time i will ever agree with donald trump https://t.co/4dcHRKc0Yt
25,2018-10-28 03:58:27,1,0,Twitter for Android,89,-0.3,"Dave Roberts has me agreeing with Donald fucking Trump. We truly are in dark, dark times."
26,2018-10-28 03:58:25,0,0,Twitter for iPhone,67,0.0,@designatedkyle @realDonaldTrump Socks in Friendswood Donald Trump.
27,2018-10-28 03:58:25,0,0,Twitter for iPhone,128,0.0,Fact check: Pittsburgh synagogue shooter Robert Bowers and his views toward Donald Trump - Palmer Report https://t.co/tbroL0nhM3
28,2018-10-28 03:58:24,0,0,WordPress.com,111,0.0,David Frum on why Republicans chose Trumpocracy over democracy  https://t.co/L5ZvXwqn1e https://t.co/WiN2TUNB1C
29,2018-10-28 03:58:21,0,0,Twitter Web Client,143,-0.7142857142857143,A BBC presenter pretended to be sick after recalling what Donald Trump once told her before an interview. https://t.co/gY6EmdGmXg via @HuffPost
30,2018-10-28 03:58:18,0,0,Twitter for iPhone,104,0.16,Report: The Phillies once scouted Donald Trump as a high school baseball player  https://t.co/7kikuVfA79
31,2018-10-28 03:58:15,0,0,Twitter for iPhone,148,-0.2,I am unnerved that Donald Trump just tweeted about the game I’m watching from the same account that he has an internet relationship with Kim Jong-Un
32,2018-10-28 03:58:14,0,0,Twitter for iPhone,223,0.125,@tribelaw Totally agree! Our GOP Congressmen/women have done NOTHING to make us think any of them@live in a higher plane than does donald trump. Those who do nothing to STOP the hatefulness are COMPLICIT in the hatefulness!
33,2018-10-28 03:58:09,0,0,Twitter Web Client,129,0.1595238095238095,Alt-right social media site Gab in meltdown mode after Pittsburgh shooting -- begs Donald Trump to 'ACT!' https://t.co/0lwJCdFZk4
34,2018-10-28 03:58:09,3,1,TrumpTweetWeather,247,0.13999999999999999,"@realdonaldtrump Current: Cloudy with regular tweets; 27% chance Donald Trump wrote this himself.

Tweet Forecast: Their thinking and made McCabe look like a baby and begged for his heroic act in saving so many illegal leaks coming out of control!"
35,2018-10-28 03:58:08,0,0,Twitter for iPhone,61,0.8,I am now a Donald trump fan lol #maga https://t.co/uyUGXk3Mty
36,2018-10-28 03:58:02,6,5,Hootsuite,130,0.1595238095238095,"Alt-right social media site Gab in meltdown mode after Pittsburgh shooting -- begs Donald Trump to 'ACT!'

https://t.co/C9iSjSVOuJ"
37,2018-10-28 03:58:02,0,1,Twitter for iPhone,66,0.0,Hasta Donald Trump critica a Dave Roberts. https://t.co/kyWQEm9DcW
38,2018-10-28 03:58:01,0,0,Twitter Web Client,198,0.0,"#maga #tcot #ccot #AmericaFirst #synagogueshootings @potus

Donald Trump jokes about his hair being ruined by having to answer questions in the rain about Pittsburgh shooting https://t.co/5eDp0Zdgks"
39,2018-10-28 03:58:00,0,0,Facebook,59,-0.6,You’ve got to be fucking kidding me https://t.co/hqoRzlAWal
40,2018-10-28 03:58:00,0,0,Twitter Web Client,129,0.1595238095238095,Alt-right social media site Gab in meltdown mode after Pittsburgh shooting -- begs Donald Trump to 'ACT!' https://t.co/aNDJgD8nHH
41,2018-10-28 03:57:59,0,0,Twitter Web Client,84,0.0,Barack Obama takes aim at Donald Trump for 'making stuff up' https://t.co/CL9jMqu0Fe
42,2018-10-28 03:57:59,0,0,Twitter for iPhone,158,0.5,"@ajhollywd Have you read this? Rebecca Solnit is always on point, but this is one of the most viscerally satisfying pieces of hers...

https://t.co/NdVpw0y18N"
43,2018-10-28 03:57:56,0,0,Twitter for Android,280,-0.2885416666666667,Donald Trump is talking about baseball yes I know they had this little competition going on but for Christ sake at what point can t separate himself from fiction to reality. It's just insulting. This fool can't even keep his story straight in half an hour. His name makes me vomit
44,2018-10-28 03:57:52,0,0,Facebook,81,-0.3,Trump warns of violence if GOP loses midterms - CNN Video https://t.co/QGvOjUa2i8
45,2018-10-28 03:57:52,1,0,Twitter for Android,292,-0.6333333333333333,🌎🌞🌟🌙🎓🚝🇺🇸🐘🐘🐘🐘🐘USA NIRANKARI NEWS..ARJUNASUBHASH NIRANKARI CHANDER TELLING USAMOTHERLAND PEOPLETHAT STUPID UNFAITHFUL PLAYS UNFAIRLY TRAITORS LIARS HATEFUL VENGEFUL USAPRESIDENT DONALD TRUMP'S ARE PUTTING DRAIN2NOTLIKED PEOPLETHAT'S ALL OF Y'ALL MAKESTRUMPS FEELSUPERIOR https://t.co/VeGpohL6Ph
46,2018-10-28 03:57:49,0,0,Twitter for iPhone,147,-0.012500000000000011,@realDonaldTrump For the first time since January 20th 2017 Liberal Los Angeles might hate someone more than Donald Trump.. https://t.co/6LGP1fUUg6
47,2018-10-28 03:57:43,0,0,Twitter for Android,203,-0.6749999999999999,"Just to recap how we got here (again), and how the ancient hate returned: Donald Trump suggests Jews are secretly committing anti-Semitic hate crimes on themselves so he looks bad https://t.co/OsMQiQ4ISL"
48,2018-10-28 03:57:43,6,6,Twitter for Android,172,0.0,@realDonaldTrump BREAKING: Authorities have intercepted a suspicious package addressed to Donald Trump containing a dictionary the US Constitution and Baseball for Dummies!
49,2018-10-28 03:57:41,0,0,Trumpet Bot,254,0.0,"...they then used to start an investigation into potential collusion between Donald Trump and the Russians - and here we are, a year and get no appreciation or respect. They don’t even want to negotiate a deal on North Korea are now all over the country!"
50,2018-10-28 03:57:40,0,0,Twitter for iPhone,147,-0.5,Barack Obama rips Donald Trump: 'It's wrong to spend all your time from a position of power vilifying people' - CNNPolitics https://t.co/PyEohNf6fB
51,2018-10-28 03:57:33,0,0,Twitter for iPhone,72,-0.8,@benmaller @realDonaldTrump Another reason to hate Donald Trump. #RedSox
52,2018-10-28 03:57:32,0,0,Twitter for iPhone,88,0.13636363636363635,is donald trump the new dodgers manager if they lose this series https://t.co/sPSm5Pdw6I
53,2018-10-28 03:57:29,0,0,Hootsuite Inc.,191,0.0,"How is it that people who actually murder, maim, and injure others are against patriotic Republicans and Donald Trump?

Trump At War - A Film by Stephen K. Bannon https://t.co/gSqTYrDzjk #G8M"
54,2018-10-28 03:57:28,0,0,Google,121,0.425,I liked a @YouTube video https://t.co/XZvtZZSubA Hanging Out with Donald Trump... (https://t.co/1rFxdXzI23 Funny Moments)
55,2018-10-28 03:57:23,18,6,GraphityCampaignNDTV,118,-0.15555555555555559,Donald Trump turns down India's invite to be chief guest at Republic Day celebrations: reports https://t.co/LEEhcluaY4
56,2018-10-28 03:57:15,0,0,Twitter for iPhone,46,0.0,"Me          Donald Trump
        🤝
     Sports"
57,2018-10-28 03:57:11,0,0,Twitter Lite,362,-0.15333333333333335,@bradheath @getongab @stripe @PayPal @joyent @realDonaldTrump @BradHeath The bean counters could censor the entire internet and I still would never read @USAToday. May get back into gardening. Social media and the media are both worthless. Unelected global governance will never be our credo and Donald Trump will still be your President. https://t.co/89WTbfFCVt
58,2018-10-28 03:57:10,1,0,Twitter for iPhone,109,0.09999999999999998,"HAHA when Donald Trump could’ve coached a better game, you know you need to be fired. https://t.co/63WgVadDKU"
59,2018-10-28 03:57:07,0,0,Twitter for iPhone,52,0.0,Donald Trump for MLB Manager https://t.co/jojJnhRf84
60,2018-10-28 03:57:07,0,0,Twitter for Android,256,0.25,"All these famous Americans moaning about Donald Trump, why don't you actually do something about it then? You have a voice that people will follow, start a rally, a protest, anything! Instead of just tweeting about it, and then maybe something will change."
61,2018-10-28 03:57:06,0,0,Twitter Web Client,342,-0.125,"@LisaM3732 @MickeyGillick4 @davidaxelrod @GOP @realDonaldTrump Fox News supports all conservatives and most Republicans. Damn few lefties. That's the way we like it. We'll see who ends up winners. Actually, CNN, MSNBC would fizzle and die without Donald Trump They gotta have somebody to hate or they have no Raison d'etre. I trust Trump, Fox"
62,2018-10-28 03:57:05,0,0,Twitter for iPhone,216,0.1025,@BDUTT Why was it leaked means? It is not a national secret. It is always known every year. Only thing is no foreign dignitary ever declines. Donald Trump is one of his own. Indian authorities should have been aware.
63,2018-10-28 03:57:04,5,1,Twitter for iPhone,79,0.0,BREAKING: Donald Trump to interview for Mets GM opening https://t.co/tGc3Wt6k75
64,2018-10-28 03:57:02,0,0,Twitter Web Client,69,0.0,maybe Donald Trump should buy the Yankees heh https://t.co/PPzdBjlkPe
65,2018-10-28 03:57:02,0,0,Twitter for Android,87,-0.2,Bruh. DONALD. TRUMP. Even he sees this shit I can't believe it. https://t.co/l7uAnbBgf5
66,2018-10-28 03:57:00,0,0,Twitter Web Client,202,-0.1875,"All you pollsters who are inordinately concerned with how much/little conservatives feel about the job Trump is doing, how about asking Pittsburgh voters what they think of this? https://t.co/QFvj29RZH7"
67,2018-10-28 03:56:58,0,0,Twitter for iPhone,196,-1.0,"@NancySinatra @MSNBC The hateful and divisive rhetoric of Donald Trump inspires these types of attacks... “Hating and cruel, you’re not my America!” https://t.co/kyr3jVNMBr https://t.co/xy1nH92cz1"
68,2018-10-28 03:56:55,0,0,Twitter for Android,289,-0.27708333333333335,"@JanelleCantre12 @foldberg1 @ewallace4854 @realDonaldTrump Seriously Janelle, what does Jesus have to do with Donald trump? You would really dishonor Jesus Christ by mentioning him in the same sentence as trump? God's going to be very disappointed in you! Maybe even not invite you at all!"
69,2018-10-28 03:56:55,0,0,Google,121,0.425,I liked a @YouTube video https://t.co/CJK5vggfGi Hanging Out with Donald Trump... (https://t.co/teWgCc6JJ3 Funny Moments)
70,2018-10-28 03:56:54,0,0,Facebook,50,0.0,Donald J. Trump on Twitter https://t.co/w22AIo9ivT
71,2018-10-28 03:56:54,0,0,Twitter for iPhone,303,0.0,"“If you meet every day with optimism – if you confront every obstacle with determination – if you refuse to give up, if you never quit, if you face every challenge with confidence and pride – then there is no goal you cannot achieve, and no dream beyond your reach!” Donald Trump https://t.co/kltEHinU4Z"
72,2018-10-28 03:56:52,0,0,Twitter Lite,284,-0.11111111111111109,@ChrisCuomo But he HAS won stupid. He's IN the WH and he's going to win by double digits next time. It's YOU that don't see. It's idiotic statements like this that keep CNN at the bottom. WE ARE WITH DONALD TRUMP and when the GOP cleans up next week you'll get the picture. #MAGA #GOP
73,2018-10-28 03:56:47,1,1,Twitter for Android,219,0.16666666666666666,"Took this photo at a Donald Trump rally last week in Mesa, Arizona.

Looked more like a presidential inauguration to me, oh these were just the people who couldn't get in.

There is no red wave!😂 https://t.co/C08DzeD7Gi"
74,2018-10-28 03:56:46,0,0,Twitter for iPhone,107,0.0,A massacre in Pittsburgh illustrates America’s disunity - Donald Trump and violence https://t.co/yq0iOI2thx
75,2018-10-28 03:56:38,0,0,Twitter for iPhone,79,0.4,@Lucy246411 @realDonaldTrump Donald Trump lives rent free in your head! MAGA 🇺🇸
76,2018-10-28 03:56:35,0,0,Twitter for iPhone,183,1.0,This just made my night. And officially made Donald J. Trump the greatest sports commentator in US Presidential history! God Bless America. 🇺🇸 @realDonaldTrump https://t.co/64teCyBXul
77,2018-10-28 03:56:31,0,0,Twitter Web Client,253,0.26666666666666666,Please ignore this. Don't respond. Do not over react on the border. You have a group of young kids defending our country. Do not turn this into another Kent State. You are better off with video showing them invading our country.  the real Donald J Trump
78,2018-10-28 03:56:29,0,0,Twitter for Android,256,-0.15555555555555559,@realDonaldTrump was born to be president! I watched an interview with Donald Trump and Oprah years ago I knew then he was going to be president one day! He is serving his country now the way God meant for him to be! He will go down as one of the GREATS!!!
79,2018-10-28 03:56:28,0,0,Twitter for iPhone,44,0.0,GO AWAY DONALD TRUMP https://t.co/QEvPnBIVil
80,2018-10-28 03:56:23,0,0,IFTTT,76,0.0,#RT @DRUDGE_REPORT: DOWD:  Riling Up the Crazies...  https://t.co/QM1ce276RS
81,2018-10-28 03:56:23,0,0,Twitter Lite,151,0.1,Bro this dude Dave Roberts got me out here agreeing with the likes of Skip Bayless and Donald J Trump....wow...HES GOT TO GO.😂😭 https://t.co/2XtwfER0nt
82,2018-10-28 03:56:22,0,0,Twitter for iPad,210,0.0,"@DavidAFrench Don’t you think abjuring from using “globalists” as an epithet and inventing Protocols-like conspiracies about George Soros (like Glenn Beck, Donald Trump and Lou Dobbs) satisfies both strategies?"
83,2018-10-28 03:56:19,1,1,Twitter Web Client,145,0.0,@TruthFaustino it gives me comfort to know that donald trump probably doesn't watch the NBA at all and i never have to worry about this situation
84,2018-10-28 03:56:18,0,0,Twitter Web Client,134,-0.6333333333333333,Donald Trump suggests Jews might secretly be committing anti-Semitic hate crimes on themselves so he looks bad https://t.co/lRkV81z1C2
85,2018-10-28 03:56:16,0,0,Facebook,112,0.0,MUST SEE! This Donald Trump Message Will Change Your Life Forever - IF YOU LISTEN TO IT! https://t.co/cpNp9opLr1
86,2018-10-28 03:56:16,0,0,Twitter for iPhone,218,0.11785714285714285,"@carolynreams1 @jonathanalter You’re so right. They can’t get over the fact that despite a stacked deck in her favor, and “all” the obstacles in front of him, Donald Trump  kicked the living sh*t out of @TheDemocrats !"
87,2018-10-28 03:56:15,1,0,Twitter for iPhone,119,-0.17857142857142855,If you’re talking shit on the Dodgers right now just know that you agree with Donald Trump. Fucking MAGA pieces of shit
88,2018-10-28 03:56:13,0,0,Twitter for iPhone,220,0.13636363636363635,"@leahmcelrath “...Ivana Trump told her lawyer Michael Kennedy that from time to time her husband reads a book of Hitler’s collected speeches, My New Order, which he keeps in a cabinet by his bed.”
https://t.co/ai4o7wijQO"
89,2018-10-28 03:56:10,0,0,Twitter for iPhone,125,-0.4,"Dave Roberts made me share an opinion with Donald Trump I can never forgive this, also fuck you u bum https://t.co/kwIyAajyLk"
90,2018-10-28 03:56:08,0,0,Twitter for iPhone,83,-0.8,Even Donald Trump is making sense. Dave Roberts is an idiot https://t.co/T6vxfo5Rb4
91,2018-10-28 03:56:06,0,0,Twitter for Android,87,-0.3,"Spot on!-
What Donald Trump Has in Common With Huckleberry Finn https://t.co/pINVUekTvr"
92,2018-10-28 03:56:03,0,0,Facebook,119,0.0,Donald Trump Jr. Refers To Democratic Senator As 'A Piece Of Garbage' - The United States Blues https://t.co/HbBRYcvlZj
93,2018-10-28 03:55:59,0,0,Twitter for iPhone,39,0.0,Donald Trump spitting nothing but facts
94,2018-10-28 03:55:57,0,0,Twitter Web Client,60,0.0,Donald Trump HATES analytics twitter https://t.co/rtbemLVQpd
95,2018-10-28 03:55:56,0,0,Twitter for Android,72,0.0,@kylegriffin1 @coxad1449 Of course they didn't.  See also: Donald Trump.
96,2018-10-28 03:55:55,0,0,Twitter Lite,110,-0.325,I thank God for Donald Trump keep him in your prayers he is fighting against true evil https://t.co/vao8Lue8NC
97,2018-10-28 03:55:53,0,0,Twitter for iPhone,97,0.5,@ScottMStedman This is an excellent documentary.  Zembla’s “The Dubious Friends Of Donald Trump”.
98,2018-10-28 03:55:49,0,0,Twitter for Android,161,-0.6333333333333333,"Donald Trump suggests Jews might secretly be committing anti-Semitic hate crimes on themselves so he looks bad
@realDonaldTrump #MAGANAZI
https://t.co/ncFmwSpySU"
99,2018-10-28 03:55:47,1,2,TweetDeck,321,-0.16666666666666666,"@draymonster23 @MaestasRicardo @realDonaldTrump 1) I despise Bernie Sanders. He failed to condemn his supporters' intimidation and occasional violence during the primaries. He's a self-righteous dick, IMHO.

2) Even so, Bernie Sanders never once incited political violence like Donald Trump does EVERY DAY at his rallies."
100,2018-10-28 03:55:45,1,0,Twitter for Android,57,0.0,O Dave Roberts me fez retweetar o Donald trump #MLBnaESPN
101,2018-10-28 03:55:44,0,0,Twitter for iPhone,77,-0.5,And that was the moment Donald Trump became President (of angry Cubs Twitter)
102,2018-10-28 03:55:44,0,0,Twitter for iPhone,51,0.0,Why is Donald trump tweeting about baseball 💀💀💀💀💀💀💀
103,2018-10-28 03:55:43,0,0,Twitter for iPhone,126,0.175,"This fool Donald Trump said shellacked and if we’re being honest I’m not really sure what that means, but ima start saying it."
104,2018-10-28 03:55:43,1,0,Twitter Web Client,118,0.20000000000000004,"even Donald Trump realizes that Dave Roberts is an absolute shit manager, truly amazing stuff. https://t.co/KsM75LLnrG"
105,2018-10-28 03:55:41,0,0,Twitter for Android,112,0.0,@molly_knight if it meant getting him out if the oval office would you sign donald trump as the dodgers manager?
106,2018-10-28 03:55:39,0,0,Twitter Web Client,205,0.2333333333333333,"But on a real note, Donald Trump doesn't understand the 3rd time through the order, pitcher fatigue, and the strength of the Dodgers pen (which is to no one's surprise bc he doesn't understand most things)"
107,2018-10-28 03:55:36,0,0,Twitter Web Client,91,0.0,"Trump: I'm a nationalist, but not a white nationalist https://t.co/zhlVbbfRhy via @politico"
108,2018-10-28 03:55:35,0,0,Twitter for iPhone,74,0.1,I just agreed with Donald Trump. What a wild time. https://t.co/gMCysw4e9K
109,2018-10-28 03:55:34,0,0,Twitter for iPhone,105,0.0,"@SopanDeb Something I actually agree with Donald Trump, like Trump says “You’re Fired!!” #FireDaveRoberts"
110,2018-10-28 03:55:29,0,0,Twitter for iPhone,70,0.0,"Mark your calendars, I agree with Donald Trump https://t.co/7L8N3ws0Q2"
111,2018-10-28 03:55:29,1,0,Twitter Lite,85,0.1,John Smoltz is Donald Trump. What a freaking time to be alive https://t.co/p991Uu0aL0
112,2018-10-28 03:55:28,0,0,Twitter Web Client,329,0.072,"@guitarviator @BravenakBlog @ZachsMind @Amaliada As long as the U.S., Russia, the UK, and France have 98% of the world's nuclear stockpiles, we're scarily likely to be the ones to unleash cleansing thermonuclear fire any day now. Like, donald trump simply running out of Diet Coke brings it to a pretty high order of probability."
113,2018-10-28 03:55:27,1,0,Twitter for Android,178,0.25,"Donald Trump, unsurprisingly, is unfamiliar with the third time through the order penalty. Also... 'reliever(s)'? Do teams bring in more than one at once? https://t.co/nkRAx3w48Z"
114,2018-10-28 03:55:27,4,4,Twitter for iPhone,63,0.0,Dave Roberts getting chirped by Donald Trump is all time comedy
115,2018-10-28 03:55:26,1,0,Twitter for iPhone,114,-0.09999999999999999,My life as a Dodger fan hit absolute rock bottom over the last hour and who did we bump into? Donald Effing Trump.
116,2018-10-28 03:55:23,0,0,Twitter for iPhone,88,0.06818181818181818,"“Donald trump doesn’t like Mexico so he obviously doesn’t like New Mexico “ 

-charlecia"
117,2018-10-28 03:55:18,0,0,Twitter Lite,93,0.2,@NRCC Get real.  I will not support the Embarassment that is Donald Trump.  #Not my President
118,2018-10-28 03:55:16,0,0,Twitter for Android,120,-0.125,@dmorchy @juliaioffe If you think Donald Trump is ever anything other than PRO Donald Trump you are not thinking at all.
119,2018-10-28 03:55:16,0,0,TagsZmontoya,23,0.0,“President Donald Trump
120,2018-10-28 03:55:11,1,0,Twitter for iPhone,70,0.0,you know it’s over when you agree with donald trump on something SKSKS
121,2018-10-28 03:55:10,2,0,Twitter for Android,113,0.0,"I know I've said this before, but Donald Trump is LITERALLY a WFAN caller. Back afta dis. https://t.co/pDSFYzFO0n"
122,2018-10-28 03:55:04,0,0,Twitter for Android,106,-0.2,Donald Trump lives in OUR house...but he is not fit to be OUR president. #VOTEBLUE https://t.co/zoIAlDOsbp
123,2018-10-28 03:55:04,165,36,Twitter for iPhone,88,-0.6999999999999998,Donald Trump is tweeting about how bad Dave Roberts is I am tweeting from the afterlife.
124,2018-10-28 03:55:02,0,0,Twitter Web Client,84,0.0,"Hey Donald Trump, we found your terrorists https://t.co/NbWmF7Fa3u via @PalmerReport"
125,2018-10-28 03:55:01,0,0,Twitter for iPhone,65,0.0,EVEN DONALD TRUMP CAN’T STAND DAVE ROBERTS AS A MANAGER. IMAGINE.
126,2018-10-28 03:55:00,0,0,Twitter for iPhone,127,0.0,"Donald Trump I don’t care what anyone says about you, this is the probably the truest tweet of all time https://t.co/aqebd217dS"
127,2018-10-28 03:54:59,0,0,Tweetbot for iΟS,79,0.5,"Even Donald trump is a better manager than Dave Roberts
https://t.co/l0nodvPJGz"
128,2018-10-28 03:54:58,0,0,Twitter for Android,125,0.25,DHS chief marks first section of Trump's border wall. (But it kinda looks like a fence.) https://t.co/nAQzIdj7eH via @NBCNews
129,2018-10-28 03:54:58,3,0,Twitter for iPhone,77,-0.6999999999999998,@DodgersNation @realFRG You know it’s bad when Donald Trump calls out Roberts
130,2018-10-28 03:54:58,0,1,Twitter for iPhone,157,-0.7,Dave Roberts is so stupid that our president literally called him out for this shitshow. DONALD FUCKING TRUMP. I have no respect for either of them but damn.
131,2018-10-28 03:54:58,1,0,Twitter for iPhone,78,0.1,Donald Trump deadass roasted Dave Roberts on Twitter 💀 What a time to be alive
132,2018-10-28 03:54:57,0,0,Twitter for Android,109,0.25,@JimmyFalk5 @realDonaldTrump Human trafficking sure exploded with Donald Trump. I guess he's the ring leader.
